nr,skjal_nr,heimilisfang,tegund,nidurstada,spurning
1625 (01.04.602.801),BN016251,Álfabakki 7,endurnýjun á skilti,Samþykkt. Þinglýsa skal kvöð um að skilti skuli fjarlægt  borgarsjóði að kostnaðarlausu þegar krafist verður. Samræmist fyrra leyfi.,Sótt er um leyfi til þess að reisa skilti á sama stað og áður samþykkt skilti stendur utan  lóðar nr. 7 við Álfabakka.  Gjald kr. 2.500
1625 (01.01.184.444),BN016258,Baldursgata 7,Reyndarteikningar.,Frestað. Vísað til athugasemda á umsóknarblaði.,"Sótt er um leyfi til þess að gera smávægilegar innri breytingar á 1. hæð, skipta 3. hæð í tvær íbúðir og stækka kvist garðmegin á húsinu á lóðinni nr. 7 við Baldursgötu.  Gjald kr. 2.500  Ljósrit af eignaskiptingu dags. ´78 eða ´79 og skoðunarskýrsla byggingarfulltrúa dags. 15. janúar 1998 fylgja erindinu."
1625 (01.01.180.208),BN016259,Bergstaðastræti 10A,"Breyting í kjallara, eignarmörk færast.",Frestað. Vantar eignanúmer.,Ofanritaður sækir um f.h. dánarbús Guðrúnar Farestveit leyfi fyrir lagfærðum teikningum af kjallara hússins á lóðinni nr. 10A við Bergstaðastræti.  Gjald kr. 2.500
1625 (01.01.218.103),BN016254,Borgartún 29,breyting úti,Frestað. Vantar samþykki meðeigenda.,"Sótt er um leyfi til þess að klæða bakhús með standandi stálklæðningu, setja fjórar nýjar bílskúrshurðir á bakhlið og skyggni yfir innganga á austur og vesturhlið hússins á lóðinni nr. 29 við Borgartún.  Gjald kr. 2.500"
1625 (01.02.354.401),BN016256,Breiðavík 15,Setja súlur undir svalir og steypt handriði að hluta á svalir.,Samþykkt. Fullnægjandi lausn. Frágangur á lóðamörkum verði gerður í samráði við lóðarhafa aðliggjandi lóða. Áskilin lokaúttekt byggingarfulltrúa.,Sótt er um leyfi til þess að setja súlur undir svalir hússins á lóðinni nr. 15 við Breiðuvík.  Gjald kr. 2.500
1626 (01.01.384.205),BN016263,Dyngjuvegur 18,Reyndarteikningar,Frestað. Vísað til athugasemda á umsóknarblaði.,Sótt er um leyfi fyrir smávægilegum innri breytingum í kjallara og á jarðhæð hússins á lóðinni nr. 18 við Dyngjuveg.  Gjald kr. 2.500
1626 (01.01.61-.-99),BN016266,Flugvöllur Loftleiðir,Breyta innra skipulagi.,Frestað. Samræma brunavarnauppdrátt frá 1996 þeirri breytingu sem nú er sótt um.,Sótt er um leyfi til þess að breyta innra fyrirkomulagi á hluta af jarðhæð Hótels Loftleiða við Reykjavíkurflugvöll.  Gjald kr. 2.500
1614 (01.02.856.704),BN016142,Frostafold 23,Taka í notkun og setja glugga á rými,Frestað. Vísað til athugasemda á umsóknarblaði.,"Sótt er um leyfi til þess að nýta áður óútgrafið rými og fá samþykkta tvo glugga á 1. hæð hússins á lóðinni nr. 23 við Frostafold.  Stærð: kjallari 36,5 ferm., 98,6 rúmm.  Gjald kr. 2.387 + 2.354  Samþykki meðeigenda dags. 4. desember 1997 fylgir erindinu."
1624,BN016243,Gautavík 25 - 27,br á teikningum sorp þak og fl.,Samþykkt. Fullnægjandi lausn. Frágangur á lóðamörkum verði gerður í samráði við lóðarhafa aðliggjandi lóða.,Sótt er um leyfi til þess að breyta lítilsháttar þaki yfir stigshúsi og koma fyrir sorpniðurkasti í húsinu á lóðinni nr. 25-27 við Gautavík.  Gjald kr. 2.500
1605 (01.01.190.109),BN016055,Grettisgata 54,Reyndarteikning.,Frestað. Vísað til athugasemda á umsóknarblaði.,"Sótt er um leyfi fyrir núverandi fyrirkomulagi í húsinu á lóðinni nr. 54 við Grettisgötu vegna eiganskipta, sameina mhl. 01 og 02  og að setja glugga garðmegin og samþykkja geymsluskúr á lóð.  Stærð: 6,9 ferm., 15,5 rúmm.  Gjald kr. 2.387 + 388  Samþykki meðeigenda dags. 1. ágúst 1997 fylgir erindinu."
1624 (01.01.137.421),BN016241,Hávallagata 44,reyndarteikning,Frestað. Vísað til athugasemda á umsóknarblaði.,Sótt er um leyfi fyrir núverandi fyrirkomulagi í kjallara hússins á lóðinni nr. 44 við Hávallagötu.  Gjald kr. 2.500  Samþykki meðeigenda á teikningu dags. nóvember 1997 og umboð eins meðeiganda dags. 20. nóvember 1997 fylgir erindinu.
1565 (01.02.295.711),BN015656,Hlaðhamrar 36 - 42,"hurðir í stað glugga á bg, nr 36 - 42.",Samþykkt. Fullnægjandi lausn.,"Sótt er um leyfi til að breyta gluggum í hurðir á bílskúrum á lóðinni nr. 36-42 við Hlaðhamra.  Gjald kr. 2.387  Samþykki nágranna að Hlaðhömrum nr. 46, 48 og 50 ódagsett fyrir erindinu."
1622 (01.04.334.201),BN016226,Hraunbær 32,Reyndarteikningar,Frestað. Vísað til athugasemda á umsóknarblaði.,Sótt er um leyfi fyrir núverandi fyrirkomulagi í kjallara hússins á lóðinni nr. 32 við Hraunbæ.  Gjald kr. 2.500  Samþykki meðeigenda á teikningu dags. nóvember 1997 fylgir erindinu.
1626 (01.01.522.006),BN016261,Hringbraut 101,Reyndarteikningar,Frestað. Vísað til athugasemda á umsóknarblaði.,Sótt er um leyfi fyrir breytingum í kjallara hússins á lóðinni nr. 101 við Hringbraut.  Gjald kr. 2.500  Umboð tveggja meðeigenda dags. 5. janúar 1998 og 7. janúar 1998 og samþykki meðeigenda á teikningu dags. nóvember 1997 fylgir erindinu.
1596 (01.01.172.104),BN015963,Hverfisgata 58,Áður gerð íbúð á 1. hæð,Samþykkt. Samræmist reglum um áður gerðar íbúðir.,Sótt er um leyfi fyrir áður gerðri íbúð á 1. hæð hússins á lóðinni nr. 58 við Hverfisgötu.  Gjald kr. 2.387  Skoðunarskýrsla byggingarfulltrúa dags. 12. september 1997 og heilbrigðiseftirlits dags. 30. október 1997 fylgja erindinu.
1625 (01.01.354.109),BN016257,Kambsvegur 20,Áður gerðar breytingar vegna eignaskipta.,Frestað. Vísað til athugasemda á umsóknarblaði.,Sótt er um leyfi fyrir áður gerðri geymslu undir stiga og að skipta svölum á 3. hæð vegna eignaskipta í húsinu á lóðinni nr. 20 við Kambsveg.  Gjald kr. 2.500
1593 (01.01.721.301),BN015930,Kringlan  4-6,Sótt er um leyfi til að skipta verslunarbili í tvennt.,"Frestað. Gera grein fyrir brunavörnum, eignarhaldi og skráningarbreytingu.","Sótt er um leyfi til að breyta innra fyrirkomulagi í norðvesturhorni 2. hæðar hússins á lóðinni nr. 4-6 við Kringluna, þannig að eining sem var nr. 271 verði nr. 271 og 277.  Gjald kr. 2.387"
1620 (01.04.376.304),BN016204,Lækjarás 8,Sótt er um að stækka glugga neðri hæðar og fleira.,Samþykkt. Fullnægjandi lausn.,"Sótt er um leyfi fyrir áður gerðum breytingum sem fela í sér sameiningu tveggja íbúða og niðurfellingu stiga í austurhluta húss , gerð stiga og breytingu á innra fyrirkomulagi í miðhluta og stækka glugga á austurvegg neðri hæðar hússins á lóðinni nr. 8 við Lækjarás.  Gjald kr. 2.387"
1625 (01.01.243.133),BN016252,Mánagata 17,Reyndarteikningar,Frestað. Vísað til athugasemda á umsóknarblaði.,Sótt er um leyfi fyrir núverandi fyrirkomulagi í kjallara hússins á lóðinni nr. 17 við Mánagötu.  Gjald kr. 2.500  Samþykki meðeigenda dags. nóvember 1997 fylgir á teikningu.
1335 (01.01.702.113 01),BN013353,Mávahlíð 1,Nýr inngangur o.fl.,Frestað. Vísað til athugasemda á umsóknarblaði.,Sótt er um leyfi fyrir núverandi fyrirkomulagi (eignaskipti) og að gera nýjan inngang á norðurhlið kjallara hússins á lóðinni nr. 1 við Mávahlíð.  Gjald kr.  2.250
1567 (01.01.441.114),BN015670,Nökkvavogur 9,"Sótt er um samþykki fyrir áorðnum breytingum í kjallara 
vegna eignaskiptasamings.",Frestað. Vísað til athugasemda á umsóknarblaði.,Sótt er um leyfi fyrir breytingu í kjallara hússins á lóðinni nr. 9 við  Nökkvavog vegna eignaskipta.  Gjald kr. 2.387
1624 (01.01.462.001),BN016242,Skeifan 11,br. á innra skipulagi á 3 hæð til hægri,Frestað. Vísað til athugasemda á umsóknarblaði.,Sótt er um leyfi til þess að setja tvo fellistiga á bakhlið hússins og breyta opnanlegum glugga og  innra fyrirkomulagi á 3. hæð hússins á lóðinni nr. 11 við Skeifuna.  Gjald kr. 2.500  Samþykki meðeigenda dags. 15. desember 1997 fylgir erindinu.
1621 (01.01.460.102),BN016213,Skeifan 5,br. á innréttingu,Frestað. Vísað til athugasemda á umsóknarblaði.,Sótt er um leyfi til þess að breyta útihurðum og gluggum í annari einingu á austurhlið hússins á lóðinni nr. 5 við Skeifuna og gera milliloft í hluta hússins.  Stærð: milliloft 32 ferm.  Gjald kr. 2.500
1626 (01.01.420.601),BN016260,Skútuvogur 8,Skilti,Samþykkt. Fullnægjandi lausn.,"Sótt er um leyfi til þess að setja upp merki á þak, húshlið og girðingu, samtals ellefu merki á lóðinni nr. 8 við Skútuvog.  Gjald kr. 2.500"
1626 (01.01.791.001),BN016264,Sléttuvegur 15,Breyta þvottahúsi í sjúkranuddstofu,Frestað. Vísað til athugasemda á umsóknarblaði.,"Sótt er um leyfi til þess að breyta þvottahúsi á 3. hæð í húsinu á lóðinni nr, 15 við Sléttuveg í sjúkranuddstofu.  Gjald kr. 2.500"
1624 (01.04.061.205),BN016249,Smiðshöfði 15,Innkeyrsludyr,Frestað. Vantar lóðarstækkun og mæliblað. Vísað til athugasemda á umsóknarblaði.,"Sótt er um leyfi til þess að setja þrjár innkeyrsludyr á norðurhlið, fella niður stiga á milli kjallara og fyrstu hæðar, skipta kjallara húsnæðisins í tvo eignarhluta á  lóðinni nr. 15 við Smiðshöfða.  Gjald kr. 2.500"
1618 (01.04.063.502),BN016182,Tangarhöfði 4,Sótt er um leyfi fyrir glerbyggingu við stigahús og fleira.,Samþykkt. Fullnægjandi lausn.,"Sótt er um leyfi til þess að byggja glerskála við stigahús, breyta glugga og innkeyrsludyrum á austurhluta 1. hæðar hússins á lóðinni nr. 4 við Tangarhöfða.  Stærð: glerskáli 1. hæð 10,4 ferm., 66,3 rúmm.  Gjald kr. 2.387 + 1.575"
1623 (01.01.132.104),BN016238,Tryggvagata 16,Endurbætur v/brunamála,Samþykkt. Fullnægjandi lausn.,Sótt er um leyfi fyrir innri breytingum vegna endurbóta eldvarna og gerð eignaskipta í húsinu á lóðinni nr. 16 við Tryggvagötu.  Gjald kr. 2.500  Bréf hönnuðar dags. 30. desember 1997 fylgir erindinu.
1624 (01.02.340.301),BN016248,Tröllaborgir 15-17,"br, á áður sþ, teikningum",Frestað. Vantar skráningartöflu.,"Sótt er um leyfi til þess að breyta áður samþykktum teikningum þannig að húsið lengist um 0,93 m til vesturs og stækka því um 22,2 ferm., 76 rúmm., húsið á lóðinni nr. 15-17 við Tröllaborgir.  Stækkun: hús nr. 11 2. hæð 11,1 ferm., 3. hæð 11,1 ferm., 22,2 ferm., 76 rúmm.  Gjald kr. 2.500 + 1.900"
1624 (01.02.343.506),BN016244,Vættaborgir 23,br. á stærðum í samræmi við skráningartöflu,Samþykkt.,Sótt er um leyfi fyrir leiðréttum stærðum á teikningu af húsinu á lóðinni nr. 23 við Vættaborgir.  Gjald kr. 2.500
1627 (01.02.354.401),BN016276,Breiðavík 15,Leiðrétting á stærðum,Samþykkt.,"Á fundi byggingarnefndar þann 13. mars 1997 var samþykkt fjölbýlishús á lóðinni nr. 15 við Breiðuvík.  Stærð var bókuð 2621 rúmm., en á að vera 2680,8 rúmm."
1627 (01.01.235.121),BN016273,Hátún 45,Fella tré,Samþykkt. Samræmist reglum um trjávernd.,Sótt er um leyfi til að fella tré á lóðinni nr. 45 við Hátún.  Umsögn garðyrkjustjóra dags.  16. janúar 1998 fylgir erindinu.
1627 (01.01.241.210),BN016274,Skipholt 9,Tölusetning,Samþykkt.,"Byggingafulltrúi hefur ákveðið að lóðin Skipholt 9 heiti: Skipholt 9 - Stúfholt 1-3. Einnig hefur verið ákveðið að verslunarrými í matshluta 01, rými 01.01 og rými 01.02 verði tölusett við Skipholt 9 og íbúðir 02.01, 02.02, 02.03, 03.01, 03.01, 03.03, í matshluta 01 verði tölusettar við Stúfholt 1, íbúðir í matshluta 02, þe., 01.01, 01.02, 02.01, 02.02, 02.03, 03.01, 03.02 og 03.03 verði tölusettar við Stúfholt 3."
1625 (01.01.710.203),BN016255,Mávahlíð 30,Breyting á geymslulofti,Nei. Samræmist ekki byggingarreglugerð.,Spurt er hvort leyft verði að breyta geymslulofti í vinnuherbergi fyrir íbúð þakhæðar í húsinu á lóðinni nr. 30 við Mávahlíð.  Bréf fyrirspyrjanda dags. 9. janúar 1998 fylgir erindinu.
1626 (01.04.387.703),BN016262,Viðarás 39,Arinn,Jákvætt Að uppfylltum skilyrðum.,Spurt er hvort leyft verði að setja upp arinn og tilheyrandi reykháf á hús nr. 39 við Viðarás.
1626 (01.01.216.303),BN016267,Sætún 8,Breyting á gluggum,,Sótt er um leyfi til þess að stækka glugga á norðurhlið og koma fyrir lyftu við norðurinngang á austurhlið í húsinu nr. 8 við Sætún.  Gjald kr. 2.500
